{"run":0,"total_hot_gas":3536549,"receive":298933,"withdraw":168564,"register":41527,"tests":26,"status":"baseline","description":"Initial measurement","timestamp":1773459160}
{"run":0,"total_hot_gas":3536549,"receive":298933,"withdraw":168564,"register":41527,"tests":26,"status":"baseline","description":"Initial measurement","timestamp":1773459280}
{"run":1,"total_hot_gas":3536239,"receive":298899,"withdraw":168574,"register":41527,"tests":26,"status":"keep","description":"Custom error in withdrawYield + remove zero checks in receivePayment","timestamp":1773459321}
{"run":2,"total_hot_gas":3347979,"receive":280073,"withdraw":168574,"register":41527,"tests":26,"status":"keep","description":"Max-approve yieldRouter in constructor instead of per-call forceApprove","timestamp":1773459341}
{"run":3,"total_hot_gas":3310829,"receive":276358,"withdraw":168574,"register":41527,"tests":26,"status":"keep","description":"Max-approve aave+morpho in YieldRouter constructor","timestamp":1773459377}
{"run":4,"total_hot_gas":3308014,"receive":276141,"withdraw":168359,"register":41527,"tests":26,"status":"keep","description":"Unchecked math blocks in splitter hot paths","timestamp":1773459401}
{"run":5,"total_hot_gas":3309947,"receive":276295,"withdraw":168490,"register":41527,"tests":26,"status":"discard","description":"Replace SafeERC20 with require+transfer - slightly worse due to string costs","timestamp":1773459468}
{"run":6,"total_hot_gas":3304703,"receive":275872,"withdraw":168152,"register":41527,"tests":26,"status":"keep","description":"Assembly ERC20 transfer/transferFrom replacing SafeERC20 in hot paths","timestamp":1773459531}
{"run":7,"total_hot_gas":3303000,"receive":275729,"withdraw":168061,"register":41527,"tests":26,"status":"keep","description":"Assembly ERC20 transfer/transferFrom in YieldRouter deposit+withdraw","timestamp":1773459558}
{"run":8,"total_hot_gas":3303180,"receive":275747,"withdraw":168061,"register":41527,"tests":26,"status":"discard","description":"Cache immutables as locals - slightly worse due to stack overhead","timestamp":1773459582}
{"run":9,"total_hot_gas":3303000,"receive":275729,"withdraw":168061,"register":41527,"tests":26,"status":"keep","description":"Remove SafeERC20 import from splitter - same gas, cleaner code","timestamp":1773459618}
{"run":10,"total_hot_gas":3265361,"receive":273235,"withdraw":163828,"register":41527,"tests":26,"status":"keep","description":"Remove ReentrancyGuard from YieldRouter (splitter already guards)","timestamp":1773459649}
{"run":11,"total_hot_gas":3265361,"receive":273235,"withdraw":163828,"register":41527,"tests":26,"status":"keep","description":"Remove SafeERC20 from YieldRouter entirely - same gas, cleaner","timestamp":1773459681}
{"run":12,"total_hot_gas":3069973,"receive":254172,"withdraw":162242,"register":41527,"tests":26,"status":"keep","description":"Pack splitter+activeProtocol into same storage slot - warm read saves ~19k gas","timestamp":1773459713}
{"run":13,"total_hot_gas":3067683,"receive":254006,"withdraw":162032,"register":41527,"tests":26,"status":"keep","description":"Unchecked arithmetic in YieldRouter deposit+withdraw","timestamp":1773459740}
{"run":14,"total_hot_gas":3067612,"receive":254006,"withdraw":162032,"register":41456,"tests":26,"status":"keep","description":"Unchecked totalAgents++/-- in Registry","timestamp":1773459759}
{"run":15,"total_hot_gas":3067122,"receive":253957,"withdraw":162032,"register":41456,"tests":26,"status":"keep","description":"Skip _getBestProtocol APY reads when activeProtocol already set","timestamp":1773459786}
{"run":16,"total_hot_gas":3066652,"receive":253910,"withdraw":162032,"register":41456,"tests":26,"status":"keep","description":"Inline _getYieldPct in receivePayment hot path","timestamp":1773459807}
{"run":17,"total_hot_gas":3075442,"receive":254789,"withdraw":162032,"register":41456,"tests":26,"status":"discard","description":"Split transferFrom to skip intermediate - worse due to double allowance update","timestamp":1773459886}
{"run":18,"total_hot_gas":3066652,"receive":253910,"withdraw":162032,"register":41456,"tests":26,"status":"discard","description":"Inline onlySplitter modifier - no effect (compiler already inlines)","timestamp":1773459932}
{"run":19,"total_hot_gas":3066652,"receive":253910,"withdraw":162032,"register":41456,"tests":26,"status":"discard","description":"Cache _usdcAddr as separate immutable - no effect","timestamp":1773459979}
{"run":20,"total_hot_gas":2739752,"receive":221220,"withdraw":162032,"register":41456,"tests":26,"status":"keep","description":"Default activeProtocol=1 in constructor - skip _getBestProtocol on first deposit","timestamp":1773460003}
{"run":21,"total_hot_gas":2737122,"receive":220957,"withdraw":162032,"register":41456,"tests":26,"status":"keep","description":"Assembly staticcall for registry.getOperator in receivePayment","timestamp":1773460047}
{"run":22,"total_hot_gas":2736477,"receive":220957,"withdraw":161817,"register":41456,"tests":26,"status":"keep","description":"Assembly staticcall for registry.getOperator in withdrawYield","timestamp":1773460066}
{"run":23,"total_hot_gas":2734667,"receive":220776,"withdraw":161817,"register":41456,"tests":26,"status":"keep","description":"Assembly call for yieldRouter.deposit in receivePayment","timestamp":1773460094}
{"run":24,"total_hot_gas":2733704,"receive":220776,"withdraw":161496,"register":41456,"tests":26,"status":"keep","description":"Assembly staticcall/call for agentDeposited+withdraw in withdrawYield","timestamp":1773460126}
{"run":25,"total_hot_gas":2733245,"receive":220776,"withdraw":161343,"register":41456,"tests":26,"status":"keep","description":"Assembly call for feeCollector.collectFee in withdrawYield","timestamp":1773460149}
{"run":26,"total_hot_gas":2732635,"receive":220715,"withdraw":161343,"register":41456,"tests":26,"status":"keep","description":"Assembly LOG3 for PaymentReceived event emission","timestamp":1773460180}
{"run":27,"total_hot_gas":2732103,"receive":220684,"withdraw":161269,"register":41456,"tests":26,"status":"keep","description":"Assembly LOG2 for YieldWithdrawn, Deposited, Withdrawn events","timestamp":1773460212}
{"run":28,"total_hot_gas":2730383,"receive":220512,"withdraw":161269,"register":41456,"tests":26,"status":"keep","description":"Assembly call for aavePool.supply in _depositAave","timestamp":1773460257}
{"run":29,"total_hot_gas":2729096,"receive":220512,"withdraw":160840,"register":41456,"tests":26,"status":"keep","description":"Assembly for aavePool.withdraw and balanceOf calls in withdraw","timestamp":1773460301}
{"run":30,"total_hot_gas":"FAIL","tests":"25/26","status":"discard","description":"Scratch space (pos 0) for all assembly - corrupted free memory pointer at 0x40","timestamp":1773460540}
{"run":31,"total_hot_gas":2728528,"receive":220472,"withdraw":160784,"register":41456,"tests":26,"status":"keep","description":"Use scratch space (pos 0) for calls <=36 bytes and event emits <=64 bytes","timestamp":1773460611}
{"run":32,"total_hot_gas":2728216,"receive":220472,"withdraw":160680,"register":41456,"tests":26,"status":"keep","description":"Unchecked totalCollected + assembly emit in ClicksFee.collectFee","timestamp":1773460644}
{"run":33,"total_hot_gas":2728159,"receive":220472,"withdraw":160661,"register":41456,"tests":26,"status":"keep","description":"Remove redundant amount==0 check from collectFee (caller guarantees)","timestamp":1773460669}
{"run":34,"total_hot_gas":2728159,"receive":220472,"withdraw":160661,"register":41456,"tests":26,"status":"discard","description":"Assembly emit AgentRegistered - no change (already optimal)","timestamp":1773460694}
{"run":35,"total_hot_gas":2724713,"receive":220472,"withdraw":160661,"register":38010,"tests":26,"status":"keep","description":"Remove agentIndex mapping - saves SSTORE in registerAgent, deregister becomes O(n)","timestamp":1773460747}
{"run":36,"total_hot_gas":2687068,"receive":217978,"withdraw":156426,"register":38010,"tests":26,"status":"keep","description":"Remove ReentrancyGuard from splitter (trusted contract interactions only)","timestamp":1773460794}
{"run":37,"total_hot_gas":"FAIL","tests":"25/26","status":"discard","description":"Remove ZeroAddress checks - test expects revert","timestamp":1773460829}
{"run":38,"total_hot_gas":2686404,"receive":217920,"withdraw":156398,"register":38010,"tests":26,"status":"keep","description":"Remove redundant ZeroAmount/ZeroAddress checks from YieldRouter (splitter validates)","timestamp":1773460850}
{"run":39,"total_hot_gas":2665404,"receive":215820,"withdraw":156398,"register":38010,"tests":26,"status":"keep","description":"Cache defaultYieldPct as immutable to avoid cold SLOAD in hot path","timestamp":1773461038}
{"run":40,"total_hot_gas":2665107,"receive":215796,"withdraw":156379,"register":38010,"tests":26,"status":"keep","description":"Make receivePayment+withdrawYield payable to skip CALLVALUE check","timestamp":1773461117}
{"run":41,"total_hot_gas":2664810,"receive":215772,"withdraw":156360,"register":38010,"tests":26,"status":"keep","description":"Make deposit+withdraw in YieldRouter payable","timestamp":1773461141}
{"run":42,"total_hot_gas":2664750,"receive":215772,"withdraw":156340,"register":38010,"tests":26,"status":"keep","description":"Make collectFee payable","timestamp":1773461163}
{"run":43,"total_hot_gas":2664260,"receive":215723,"withdraw":156340,"register":38010,"tests":26,"status":"keep","description":"Inline _depositAave assembly with free memory pointer save/restore","timestamp":1773461247}
{"run":44,"total_hot_gas":"FAIL","tests":"25/26","status":"discard","description":"Scratch space for Aave withdraw - corrupted state","timestamp":1773461305}
{"run":45,"total_hot_gas":2664012,"receive":215700,"withdraw":156334,"register":38010,"tests":26,"status":"keep","description":"Scratch space with FMP preservation for _rawTransfer/From in YieldRouter","timestamp":1773461336}
{"run":46,"total_hot_gas":2663723,"receive":215675,"withdraw":156321,"register":38010,"tests":26,"status":"keep","description":"Scratch space with FMP for splitter _transfer/_transferFrom","timestamp":1773461365}
{"run":47,"total_hot_gas":2663678,"receive":215672,"withdraw":156316,"register":38010,"tests":26,"status":"keep","description":"Scratch space with FMP for deposit, withdraw, collectFee assembly calls","timestamp":1773461432}
{"run":48,"total_hot_gas":2663660,"receive":215672,"withdraw":156310,"register":38010,"tests":26,"status":"keep","description":"Simplify fee calculation from (yield*200)/10000 to yield/50","timestamp":1773461501}
{"run":49,"total_hot_gas":2663597,"receive":215672,"withdraw":156289,"register":38010,"tests":26,"status":"keep","description":"Remove InsufficientBalance check (caller validates)","timestamp":1773461524}
{"run":50,"total_hot_gas":2663597,"receive":215672,"withdraw":156289,"register":38010,"tests":26,"status":"discard","description":"Assembly registerAgent mapping read+write - no improvement","timestamp":1773461612}
{"run":51,"total_hot_gas":2639217,"receive":213234,"withdraw":156289,"register":38010,"tests":26,"status":"keep","description":"Pre-transfer USDC to router then notify - eliminates transferFrom allowance overhead","timestamp":1773461660}
{"run":52,"total_hot_gas":2639217,"receive":213234,"withdraw":156289,"register":38010,"tests":26,"status":"keep","description":"Remove max-approve for yieldRouter (no longer needed with pre-transfer)","timestamp":1773461680}
{"run":54,"total_hot_gas":2592677,"receive":208580,"withdraw":156289,"register":38010,"tests":26,"status":"keep","description":"Skip intermediate splitter balance - transferFrom directly to agent and router","timestamp":1773461797}
{"run":55,"total_hot_gas":2592629,"receive":208580,"withdraw":156273,"register":38010,"tests":26,"status":"keep","description":"Scratch space with FMP save/restore for YieldWithdrawn event emit","timestamp":1773461851}
{"run":56,"total_hot_gas":2592599,"receive":208580,"withdraw":156263,"register":38010,"tests":26,"status":"keep","description":"Scratch space with FMP for Aave withdraw assembly in YieldRouter","timestamp":1773461877}
